<?xml version="1.0" encoding="UTF-8" ?>

<xsd:schema xmlns:xsd="http://www.w3.org/2001/XMLSchema">
  <xsd:element name="ReceiptReply">
    <xsd:complexType>
      <xsd:sequence>
        <xsd:element name="MesgInfo" nillable="true" type="messageInformation"/>
        <xsd:element name="Header" nillable="true">
          <xsd:complexType>
            <xsd:sequence>
              <xsd:element name="DocInfo" nillable="true">
                <xsd:complexType>
                  <xsd:sequence>
                    <xsd:element name="AllianceID" nillable="true" type="xsd:string" minOccurs="0"/>
                    <xsd:element name="DocNo" nillable="true" type="xsd:string"/>
                    <xsd:element name="ResponseTime" nillable="true" type="xsd:string" minOccurs="0"/>
                  </xsd:sequence>
                </xsd:complexType>
              </xsd:element>
              <xsd:element name="ReplyInfo" nillable="true">
                <xsd:complexType>
                  <xsd:sequence>
                    <xsd:element name="Status" nillable="true" type="xsd:string"/>
                    <xsd:element name="Memo" nillable="true" type="xsd:string" minOccurs="0"/>
                  </xsd:sequence>
                </xsd:complexType>
              </xsd:element>
            </xsd:sequence>
          </xsd:complexType>
        </xsd:element>
        <xsd:element name="CrossRateInfo" nillable="true" type="rec_receiptCrossRateInformation"/>
        <xsd:element name="UnitPriceInfo" nillable="true" type="rec_RCPTPrice"/>
        <xsd:element name="CCD_RCPT_RECOVERED" nillable="true" type="rec_CCDReocvered"/>
      </xsd:sequence>
    </xsd:complexType>
  </xsd:element>
  <xsd:complexType name="MEDRCPTReply">
    <xsd:sequence>
      <xsd:element name="ReceiptReply" nillable="true">
        <xsd:complexType>
          <xsd:sequence>
            <xsd:element name="MesgInfo" nillable="true" type="messageInformation"/>
            <xsd:element name="Header" nillable="true">
              <xsd:complexType>
                <xsd:sequence>
                  <xsd:element name="DocInfo" nillable="true">
                    <xsd:complexType>
                      <xsd:sequence>
                        <xsd:element name="AllianceID" nillable="true" type="xsd:string" minOccurs="0"/>
                        <xsd:element name="DocNo" nillable="true" type="xsd:string"/>
                        <xsd:element name="ResponseTime" nillable="true" type="xsd:string" minOccurs="0"/>
                      </xsd:sequence>
                    </xsd:complexType>
                  </xsd:element>
                  <xsd:element name="ReplyInfo" nillable="true">
                    <xsd:complexType>
                      <xsd:sequence>
                        <xsd:element name="Status" nillable="true" type="xsd:string"/>
                        <xsd:element name="Memo" nillable="true" type="xsd:string" minOccurs="0"/>
                      </xsd:sequence>
                    </xsd:complexType>
                  </xsd:element>
                </xsd:sequence>
              </xsd:complexType>
            </xsd:element>
            <xsd:element name="CrossRateInfo" nillable="true" type="rec_receiptCrossRateInformation"/>
            <xsd:element name="UnitPriceInfo" nillable="true" type="rec_RCPTPrice"/>
            <xsd:element name="CCD_RCPT_RECOVERED" nillable="true" type="rec_CCDReocvered"/>
          </xsd:sequence>
        </xsd:complexType>
      </xsd:element>
    </xsd:sequence>
  </xsd:complexType>
  <xsd:complexType name="messageInformation">
    <xsd:sequence>
      <xsd:element name="ProcessID" nillable="true" type="xsd:string"/>
      <xsd:element name="SenderID" nillable="true" type="xsd:string"/>
      <xsd:element name="ReceiverID" nillable="true" type="xsd:string"/>
      <xsd:element name="DocumentType" nillable="true" type="xsd:string"/>
    </xsd:sequence>
  </xsd:complexType>
  <xsd:complexType name="rec_receiptCrossRateInformation">
    <xsd:sequence>
      <xsd:element name="SourceReceiptNo" nillable="true" type="xsd:string"/>
      <xsd:element name="OldRate" nillable="true" type="xsd:string"/>
      <xsd:element name="NewRate" nillable="true" type="xsd:string"/>
      <xsd:element name="Accamt" nillable="true" type="xsd:string"/>
      <xsd:element name="SourceDisamt" nillable="true" type="xsd:string"/>
      <xsd:element name="Memo" nillable="true" type="xsd:string"/>
    </xsd:sequence>
  </xsd:complexType>
  <xsd:complexType name="rec_RCPTPrice">
    <xsd:sequence>
      <xsd:element name="UNRECEIPTNO" nillable="true" type="xsd:string"/>
      <xsd:element name="RECEIPTNO" nillable="true" type="xsd:string"/>
      <xsd:element name="HOSPID" nillable="true" type="xsd:string"/>
      <xsd:element name="HOSPRGNO" nillable="true" type="xsd:string"/>
      <xsd:element name="PROCESSID" nillable="true" type="xsd:string"/>
      <xsd:element name="CONFIRMBY" nillable="true" type="xsd:string"/>
      <xsd:element name="CONFIRMTIME" nillable="true" type="xsd:string"/>
      <xsd:element name="MEMO" nillable="true" type="xsd:string"/>
      <xsd:element name="FLAG" nillable="true" type="xsd:string"/>
    </xsd:sequence>
  </xsd:complexType>
  <xsd:complexType name="rec_CCDReocvered">
    <xsd:sequence>
      <xsd:element name="REFNO" nillable="true" type="xsd:string"/>
      <xsd:element name="VERSION" nillable="true" type="xsd:string"/>
      <xsd:element name="HOSPRGNO" nillable="true" type="xsd:string"/>
      <xsd:element name="ALLIANCEID" nillable="true" type="xsd:string"/>
      <xsd:element name="RECEIPTNO" nillable="true" type="xsd:string"/>
      <xsd:element name="NEW_PRICE" nillable="true" type="xsd:string"/>
      <xsd:element name="RECOVERED_AMOUNT" nillable="true" type="xsd:string"/>
      <xsd:element name="STATUS" nillable="true" type="xsd:string"/>
      <xsd:element name="FLAG" nillable="true" type="xsd:string"/>
    </xsd:sequence>
  </xsd:complexType>
</xsd:schema>